{
  "_comment": "FIXTURE TỔNG HỢP — giao dịch trỏ tới căn CHƯA TỒN TẠI. Mong đợi: từ chối có cấu trúc (error_category=business), không tự tạo căn.",
  "schema_version": 1,
  "source_system": "mini_crm",
  "source_instance_id": "synthetic-mini-crm",
  "external_batch_id": "SYNTH-BATCH-0009",
  "sync_mode": "incremental",
  "project_ref": { "project_id": "5117d1c0-0000-4000-8000-000000000001" },
  "source_extracted_at": "2026-08-09T03:20:00+07:00",
  "records": [
    {
      "entity": "deal", "operation": "upsert", "external_id": "SYNTH-D-0099", "source_revision": 1,
      "payload": { "external_unit_id": "SYNTH-U-KHONG-TON-TAI", "deal_status": "reserved", "reserved_at": "2026-08-05T09:00:00+07:00" }
    }
  ]
}
