{
  "_comment": "FIXTURE TỔNG HỢP — chuyển reserved → sold mà VẪN mang reserved_at cũ. Mong đợi: updated. Đây là hành vi mà giả định A4 đòi hỏi ở Mini CRM tương lai.",
  "schema_version": 1,
  "source_system": "mini_crm",
  "source_instance_id": "synthetic-mini-crm",
  "external_batch_id": "SYNTH-BATCH-0013",
  "sync_mode": "incremental",
  "project_ref": { "project_id": "5117d1c0-0000-4000-8000-000000000001" },
  "source_extracted_at": "2026-08-09T02:13:00+07:00",
  "records": [
    {
      "entity": "deal", "operation": "upsert", "external_id": "SYNTH-D-0001", "source_revision": 5,
      "payload_completeness": "full",
      "payload": {
        "external_unit_id": "SYNTH-U-0002", "deal_status": "sold",
        "reserved_at": "2026-08-01T09:30:00+07:00", "sold_at": "2026-08-08T16:00:00+07:00"
      }
    }
  ]
}
