{
  "_comment": "FIXTURE TỔNG HỢP — KHÔNG PHẢI DỮ LIỆU CRM THẬT. Mini CRM chưa tồn tại.",
  "schema_version": 1,
  "source_system": "mini_crm",
  "source_instance_id": "synthetic-mini-crm",
  "external_batch_id": "SYNTH-BATCH-0001",
  "sync_mode": "incremental",
  "project_ref": { "project_id": "5117d1c0-0000-4000-8000-000000000001" },
  "source_extracted_at": "2026-08-09T02:00:00+07:00",
  "records": [
    {
      "entity": "unit", "operation": "upsert", "external_id": "SYNTH-U-0001", "source_revision": 1,
      "payload": { "area_ref": { "area_name": "A1", "unit_type": "2PN" }, "unit_code": "A1-01-01", "unit_status": "available" }
    },
    {
      "entity": "unit", "operation": "upsert", "external_id": "SYNTH-U-0002", "source_revision": 1,
      "payload": { "area_ref": { "area_name": "A1", "unit_type": "2PN" }, "unit_code": "A1-01-02", "unit_status": "reserved" }
    },
    {
      "entity": "unit", "operation": "upsert", "external_id": "SYNTH-U-0003", "source_revision": 1,
      "payload": { "area_ref": { "area_name": "A1", "unit_type": "2PN" }, "unit_code": "A1-01-03", "unit_status": "sold" }
    }
  ]
}
