{
  "_comment": "FIXTURE TỔNG HỢP — payload_completeness='partial': chỉ gửi trường đã đổi. Mong đợi: updated, reserved_at CŨ được giữ nguyên vì nó vắng mặt (không phải bị xoá), và dấu vân được tính lại theo trạng thái ĐÃ HỢP NHẤT.",
  "schema_version": 1,
  "source_system": "mini_crm",
  "source_instance_id": "synthetic-mini-crm",
  "external_batch_id": "SYNTH-BATCH-0016",
  "sync_mode": "incremental",
  "project_ref": { "project_id": "5117d1c0-0000-4000-8000-000000000001" },
  "source_extracted_at": "2026-08-09T02:16:00+07:00",
  "records": [
    {
      "entity": "deal", "operation": "upsert", "external_id": "SYNTH-D-0001", "source_revision": 8,
      "payload_completeness": "partial",
      "payload": { "deal_status": "sold", "sold_at": "2026-08-09T09:00:00+07:00" }
    }
  ]
}
