{
  "_comment": "FIXTURE TỔNG HỢP — timestamp THIẾU offset múi giờ. Mong đợi: từ chối (error_category=schema). Không suy diễn múi giờ hộ hệ nguồn.",
  "schema_version": 1,
  "source_system": "mini_crm",
  "source_instance_id": "synthetic-mini-crm",
  "external_batch_id": "SYNTH-BATCH-0012",
  "sync_mode": "incremental",
  "project_ref": { "project_id": "5117d1c0-0000-4000-8000-000000000001" },
  "source_extracted_at": "2026-08-09T03:50:00+07:00",
  "records": [
    {
      "entity": "deal", "operation": "upsert", "external_id": "SYNTH-D-0003", "source_updated_at": "2026-08-05T09:00:00",
      "payload": { "external_unit_id": "SYNTH-U-0001", "deal_status": "reserved", "reserved_at": "2026-08-05T09:00:00" }
    }
  ]
}
